{
  "$schema": "../schemas/pattern.schema.json",
  "id": "pattern.spacing-layout",
  "name": "余白の取り方",
  "purpose": "要素同士の関係と情報の階層を、Atlasの余白トークンで一貫して表現する",
  "principles": [
    {
      "id": "proximity-shows-relationship",
      "title": "関係が近いほど余白を小さくする",
      "description": "同じ情報のまとまりは近づけ、目的が異なるまとまりは広く離して、読む前から関係を判断できるようにする"
    },
    {
      "id": "outside-to-inside",
      "title": "外側から内側へ段階的に狭くする",
      "description": "ページ、セクション、グループ、要素の順に余白を小さくし、視線を大きなまとまりから詳細へ導く"
    },
    {
      "id": "token-only",
      "title": "定義済みトークンから選ぶ",
      "description": "見た目に合わせた任意の数値は増やさず、space.1からspace.12の意味と近い値を選ぶ"
    }
  ],
  "anatomy": [
    {
      "id": "page-padding",
      "name": "ページの内側余白",
      "required": true,
      "description": "デスクトップはspace.8（32px）、狭い画面は上下space.6（24px）・左右space.4（16px）を基準にする"
    },
    {
      "id": "section-gap",
      "name": "セクション間",
      "required": true,
      "description": "目的が異なる情報のまとまりをspace.8（32px）で分ける"
    },
    {
      "id": "group-gap",
      "name": "セクション内のグループ間",
      "required": true,
      "description": "関連する情報群をspace.6（24px）で分ける"
    },
    {
      "id": "element-gap",
      "name": "見出し・要素間",
      "required": true,
      "description": "見出しと内容はspace.4（16px）、アイコンと文字など強く関連する要素はspace.1〜space.2（4〜8px）を使う"
    }
  ],
  "variants": [
    {
      "id": "page-content",
      "name": "ページとセクション",
      "useWhen": "ページ全体と、その中にある複数の情報セクションを配置する",
      "avoidWhen": "コンポーネント内部だけの局所的な配置を調整する",
      "structure": ["ページ内側 space.8", "セクション間 space.8", "グループ間 space.6", "見出しと内容 space.4"],
      "desktop": "外周32px、セクション間32px、グループ間24px、見出しと内容16px",
      "narrow": "外周を上下24px・左右16pxに縮め、内容間の余白は原則として維持する"
    },
    {
      "id": "surface-content",
      "name": "サーフェスの内側",
      "useWhen": "CardやSurfaceの枠が一つの情報のまとまりを表す",
      "avoidWhen": "余白だけでまとまりを十分に示せるため、枠自体が不要な場合",
      "structure": ["内側 space.6", "グループ間 space.4", "要素間 space.2"],
      "desktop": "内側24px、グループ間16px、強く関連する要素間8px",
      "narrow": "内側を16pxに縮め、グループ間16pxと要素間8pxは維持する"
    },
    {
      "id": "dialog-content",
      "name": "ダイアログの内側",
      "useWhen": "確認や入力の内容を、説明・フォーム・操作の順に配置する",
      "avoidWhen": "常時参照する情報や、複数画面にまたがる長い操作を収める",
      "structure": ["内側 space.6", "説明とフォーム space.8", "フォーム間 space.6", "ラベルと入力 space.2"],
      "desktop": "内側24px、説明とフォーム32px、フォーム間24px、ラベルと入力8px",
      "narrow": "内側を16pxに縮め、内容同士の関係を示す余白は維持する"
    },
    {
      "id": "inline-actions",
      "name": "横並びの要素",
      "useWhen": "アイコンと文字、状態とラベル、複数の操作を横に並べる",
      "avoidWhen": "狭い画面で折り返すと操作順序や対応関係が崩れる",
      "structure": ["アイコンと文字 space.1〜2", "ボタン間 space.2〜4", "入力欄間 space.4"],
      "desktop": "アイコンと文字4〜8px、ボタン間8〜16px、入力欄間16px",
      "narrow": "同じ値を維持する。幅が足りない場合は余白を削らず縦に積み替える"
    }
  ],
  "states": ["default", "narrow"],
  "components": [
    "component.button",
    "component.card",
    "component.surface",
    "component.alert-dialog",
    "component.number-field"
  ],
  "rules": [
    "layout.grouping",
    "layout.narrow"
  ]
}
